{
  "_meta": {
    "file": "character.json",
    "version": 2,
    "owner": "systems-designer",
    "task": "P2-F10-T04; P2-H64",
    "doc": "studio/decisions/decision-log.md D-146; studio/phases/phase-2/plan-sync-f10.md P-3, P-4, R-F10-3; studio/phases/phase-2/board.md detail block P2-F10-T04; design/systems/test-vectors/character-name.json; design/narrative/F10-story.md sections 6, 7, 9",
    "readBy": [
      "packages/shared/src/character (P2-F10-T12)",
      "apps/client create-character screen (F10)"
    ],
    "_note": "Character-name filter and random-name rules. Only numbers, code-point sets and fixed markers live here. The banned-word list and the random-name pool are content owned by narrative-designer in config/content/character-names.th.json (P2-F10-T03); this file only points at them. No regex strings: every rule is a code-point range, a substring marker or a count, so ports need no RegExp construction and no new Function. Code points are written as 'U+XXXX' strings (hex, inclusive ranges). Phase 2 names stay on the device; Phase 3 runs the same module on the server (NN-1)"
  },
  "_source": {
    "name": "D-146 (typed name + filter: length and charset from config, rude words, phone/email/link patterns, real-name warning, random button); human pick 2026-10-01: suggested 2-16 characters, Thai and English",
    "name.lengthUnit": "board P2-F10-T04 acceptance: length in grapheme clusters (Thai vowels and tone marks above/below do not count as extra characters)",
    "name.allowed": "board P2-F10-T04 acceptance: Thai Unicode range, Latin, digits, single space",
    "contact": "D-146 (phone/email/link patterns); CLAUDE.md NN-4 (no free-text channel) and NN-7 (no real identity in profiles)",
    "banned": "D-146 (rude words); plan-sync-f10 P-3 (list is content, narrative-designer); F10-story.md section 7 (two passes, modes, allow); T12 acceptance (compare after removing tone marks and repeats)",
    "random": "D-146 (random-name button); board P2-F10-T04 acceptance (max re-rolls before fallback); T12 acceptance (random name always passes validate)"
  },
  "name": {
    "minGraphemes": 2,
    "maxGraphemes": 16,
    "lengthUnit": "graphemeCluster",
    "segmenter": {
      "_source": "board P2-F10-T04 acceptance (length in grapheme clusters); Intl.Segmenter is the platform grapheme API in browsers and Node",
      "api": "Intl.Segmenter",
      "locale": "th",
      "granularity": "grapheme"
    },
    "normalize": {
      "_source": "board P2-F10-T12 acceptance (NFC, strip zero-width, collapse spaces); P2-F10-T04 acceptance (single space)",
      "form": "NFC",
      "stripCodePoints": [
        {
          "from": "U+00AD",
          "to": "U+00AD",
          "label": "soft hyphen"
        },
        {
          "from": "U+200B",
          "to": "U+200F",
          "label": "zero-width space/joiners, LRM, RLM"
        },
        {
          "from": "U+202A",
          "to": "U+202E",
          "label": "bidi embedding/override"
        },
        {
          "from": "U+2060",
          "to": "U+2064",
          "label": "word joiner, invisible operators"
        },
        {
          "from": "U+FEFF",
          "to": "U+FEFF",
          "label": "BOM / zero-width no-break space"
        }
      ],
      "mapToSpace": [
        {
          "from": "U+0009",
          "to": "U+000D",
          "label": "tab, line feed, carriage return and friends"
        },
        {
          "from": "U+00A0",
          "to": "U+00A0",
          "label": "no-break space"
        },
        {
          "from": "U+2000",
          "to": "U+200A",
          "label": "typographic spaces"
        },
        {
          "from": "U+3000",
          "to": "U+3000",
          "label": "ideographic space"
        }
      ],
      "trimSpaces": true,
      "collapseSpaces": true
    },
    "allowed": [
      {
        "from": "U+0E01",
        "to": "U+0E3A",
        "label": "Thai consonants, vowels, phinthu"
      },
      {
        "from": "U+0E40",
        "to": "U+0E4E",
        "label": "Thai leading vowels, lakkhangyao, maiyamok, tone marks, thanthakhat"
      },
      {
        "from": "U+0041",
        "to": "U+005A",
        "label": "Latin A-Z"
      },
      {
        "from": "U+0061",
        "to": "U+007A",
        "label": "Latin a-z"
      },
      {
        "from": "U+0030",
        "to": "U+0039",
        "label": "ASCII digits"
      },
      {
        "from": "U+0020",
        "to": "U+0020",
        "label": "space (single, after collapse)"
      }
    ],
    "letters": [
      {
        "from": "U+0E01",
        "to": "U+0E2E",
        "label": "Thai consonants"
      },
      {
        "from": "U+0041",
        "to": "U+005A",
        "label": "Latin A-Z"
      },
      {
        "from": "U+0061",
        "to": "U+007A",
        "label": "Latin a-z"
      }
    ],
    "requireLetter": true,
    "thaiMarks": [
      {
        "from": "U+0E31",
        "to": "U+0E31",
        "label": "mai han-akat"
      },
      {
        "from": "U+0E33",
        "to": "U+0E3A",
        "label": "sara am, upper/lower vowels, phinthu"
      },
      {
        "from": "U+0E47",
        "to": "U+0E4E",
        "label": "maitaikhu, tone marks, thanthakhat, nikhahit, yamakkan"
      }
    ],
    "thaiMarkBases": [
      {
        "from": "U+0E01",
        "to": "U+0E2E",
        "label": "Thai consonants incl. ฤ ฦ"
      }
    ],
    "toneMarks": [
      {
        "from": "U+0E48",
        "to": "U+0E4B",
        "label": "mai ek, tho, tri, chattawa"
      }
    ],
    "maxCodePointsPerGrapheme": 3,
    "maxToneMarksPerGrapheme": 1,
    "rejectRepeatedMarkInGrapheme": true,
    "checkOrder": [
      "empty",
      "email",
      "url",
      "phone",
      "charset",
      "misplacedMark",
      "stackedMarks",
      "noLetter",
      "tooShort",
      "tooLong",
      "banned"
    ],
    "_note": "Pipeline: normalize (NFC, strip invisible code points, map other whitespace to U+0020, trim, collapse runs of spaces) -> run checkOrder and return the first failing reason, else ok with the normalized string (the value that is stored). Contact checks run before charset on purpose: '@', '://' and '.' are outside the charset, and the player should see the privacy reason (do not share contact details) rather than a generic charset reason. minGraphemes 2 / maxGraphemes 16 (acceptance calls them name.minLength / name.maxLength; renamed because config-lint 3.10.3 treats Length as a measured quantity that needs a unit suffix, and a count named by its noun needs none): the human's suggested range (2026-10-01); ASSUMPTION A-P2-F10-T04-1: 16 graphemes fit one line of the 360 px create-character and profile header, to be confirmed by uiux-designer in T06. A grapheme is one Intl.Segmenter grapheme cluster, so น้ำ is 1 and สมชาย is 5 (า is its own cluster). Marks: a Thai mark must sit in a cluster whose first code point is a Thai consonant (rejects a leading mark, a mark after a space and a mark on a Latin letter); maxCodePointsPerGrapheme 3 covers the longest real Thai cluster (ปั๊, สิทธิ์ ธิ์) and blocks mark stacking; at most one tone mark and no mark twice in one cluster. requireLetter: a name needs at least one Thai consonant or Latin letter, so digits-only names fail with noLetter. Thai digits U+0E50-U+0E59 are outside the charset but still counted by the phone check"
  },
  "contact": {
    "detectionForm": {
      "_source": "D-146 (phone/email/link patterns); NFKC folds fullwidth look-alikes",
      "form": "NFKC",
      "lowercase": true
    },
    "phone": {
      "_source": "D-146 (phone numbers); P2-F10-T04 acceptance (consecutive and total digit counts; 0812345678 with spaces and hyphens)",
      "digits": [
        {
          "from": "U+0030",
          "to": "U+0039",
          "label": "ASCII digits (fullwidth digits reach here through NFKC)"
        },
        {
          "from": "U+0E50",
          "to": "U+0E59",
          "label": "Thai digits"
        }
      ],
      "separators": [
        " ",
        "-",
        ".",
        "(",
        ")",
        "+",
        "_",
        "/"
      ],
      "maxDigitRun": 4,
      "maxTotalDigits": 6
    },
    "email": {
      "_source": "D-146 (email); P2-F10-T04 acceptance (@)",
      "markers": [
        "@"
      ]
    },
    "url": {
      "_source": "D-146 (links); P2-F10-T04 acceptance (://, www., TLD)",
      "markers": [
        "://",
        "www."
      ],
      "tlds": [
        "com",
        "net",
        "org",
        "co",
        "th",
        "io",
        "me",
        "ly",
        "gg",
        "app",
        "xyz",
        "info",
        "link",
        "shop",
        "site",
        "online",
        "ai",
        "tv",
        "to",
        "cc",
        "bio",
        "live"
      ],
      "spelledMarkers": [
        "dotcom",
        "dotnet",
        "ดอทคอม",
        "ดอตคอม",
        "จุดคอม"
      ]
    },
    "_note": "All contact checks read the detection form of the normalized name: NFKC (so fullwidth ＠ ０８１ and similar fold to ASCII) then lowercase. phone: a digit run counts digits while skipping any separators between them (0812345678, 081 234 5678, 081-234-5678, (02) 123 4567 are one run); fail when a run has more than maxDigitRun digits or the whole name has more than maxTotalDigits digits. Thai mobile numbers have 10 digits and Bangkok landlines 9, so with at most 6 digits in total a full number cannot be spread across the name, while a year or lucky number (2026, 99) still fits a run of 4. email: fail when any marker appears. url: fail when a marker appears; or when '.' is followed by a tld and then the end of the string or a character that is not a-z or 0-9 (so '.com' and '.co.th' hit, '.company' does not); or when a spelledMarker appears in the detection form with every space removed. Spelled-out phone numbers in words are not caught (R-F10-3; Phase 3 server re-check)"
  },
  "banned": {